{
  "contract_version": "1.0.0",
  "run_id": "run-fixture-1",
  "bundle_id": "bundle-fixture-1",
  "impact": "state-changing",
  "pins": {
    "protocol": {
      "id": "example-protocol",
      "version": "1.0.0",
      "schemaVersion": "1",
      "contentSha256": "aaaaaaaaaaaaaaaaaaaaaaaaaaaaaaaaaaaaaaaaaaaaaaaaaaaaaaaaaaaaaaaa"
    },
    "variables": [],
    "bundleSha256": "bbbbbbbbbbbbbbbbbbbbbbbbbbbbbbbbbbbbbbbbbbbbbbbbbbbbbbbbbbbbbbbb",
    "pluginVersion": "1.0.0",
    "contractVersion": "1.0.0"
  }
}
